{
  "schema_version": "3.0",
  "curated_version": "v3-routing-curated-1",
  "registry": {
    "path": ".superpowers/SKILLS_INDEX.json",
    "source": "https://github.com/juhjuhx/agent-skills.git",
    "source_ref": "main",
    "source_commit": "db3b67d5b051c4223da9146b2b836a9ed45e9bac",
    "skill_count": 214
  },
  "curator": {
    "version": "0.1.0",
    "policy": "SMALL_FIELD_PATCHES_ONLY",
    "body_policy": "READ_ONLY_NO_EXECUTION"
  },
  "skills": {
    "algorithmic-art": {
      "skill_id": "algorithmic-art",
      "source_skill_digest": "sha256:ae33152e8850a9bb5442dcef96d05225864b3658021fb5ba43d7b48302c22fb0",
      "tier": "TIER_2_DOMAIN",
      "fields": {
        "stages": {
          "value": [
            "design"
          ],
          "provenance": "CURATED",
          "confidence": 1.0,
          "evidence": "reviewed compatibility routing seed",
          "last_verified": "2026-09-09T00:00:00Z"
        },
        "roles": {
          "value": [
            "PROCESS",
            "DOMAIN"
          ],
          "provenance": "CURATED",
          "confidence": 1.0,
          "evidence": "reviewed compatibility routing seed",
          "last_verified": "2026-09-09T00:00:00Z"
        },
        "task_modes": {
          "value": [
            "design"
          ],
          "provenance": "CURATED",
          "confidence": 1.0,
          "evidence": "reviewed compatibility routing seed",
          "last_verified": "2026-09-09T00:00:00Z"
        },
        "domains": {
          "value": [
            "visual-design"
          ],
          "provenance": "CURATED",
          "confidence": 1.0,
          "evidence": "reviewed compatibility routing seed",
          "last_verified": "2026-09-09T00:00:00Z"
        }
      },
      "relationships": [],
      "review_status": "REVIEWED",
      "confidence": 1.0,
      "last_verified": "2026-09-09T00:00:00Z"
    },
    "baoyu-imagine": {
      "skill_id": "baoyu-imagine",
      "source_skill_digest": "sha256:b526a7b4d89fd9d9a2f5dafd52dbcdeb654ea305b11043ab03c74001a8e97da7",
      "tier": "TIER_2_DOMAIN",
      "fields": {},
      "relationships": [
        {
          "type": "SUPERSEDES",
          "target": "baoyu-image-gen",
          "reason": "canonical body explicitly marks image-gen deprecated",
          "provenance": "CURATED",
          "confidence": 1.0,
          "evidence": "canonical body explicitly marks image-gen deprecated"
        }
      ],
      "review_status": "REVIEWED",
      "confidence": 1.0,
      "last_verified": "2026-09-09T00:00:00Z"
    },
    "baoyu-slide-deck": {
      "skill_id": "baoyu-slide-deck",
      "source_skill_digest": "sha256:36aef4e30a46878f4274654dbd19885163c0ca9c0fd512180c029b1612292b40",
      "tier": "TIER_2_DOMAIN",
      "fields": {
        "stages": {
          "value": [
            "design",
            "implement"
          ],
          "provenance": "CURATED",
          "confidence": 1.0,
          "evidence": "reviewed compatibility routing seed",
          "last_verified": "2026-09-09T00:00:00Z"
        },
        "roles": {
          "value": [
            "PROCESS",
            "DOMAIN"
          ],
          "provenance": "CURATED",
          "confidence": 1.0,
          "evidence": "reviewed compatibility routing seed",
          "last_verified": "2026-09-09T00:00:00Z"
        },
        "task_modes": {
          "value": [
            "design",
            "implementation"
          ],
          "provenance": "CURATED",
          "confidence": 1.0,
          "evidence": "reviewed compatibility routing seed",
          "last_verified": "2026-09-09T00:00:00Z"
        },
        "domains": {
          "value": [
            "visual-design"
          ],
          "provenance": "CURATED",
          "confidence": 1.0,
          "evidence": "reviewed compatibility routing seed",
          "last_verified": "2026-09-09T00:00:00Z"
        },
        "outputs": {
          "value": [
            "presentation",
            "visual design"
          ],
          "provenance": "CURATED",
          "confidence": 1.0,
          "evidence": "reviewed compatibility routing seed",
          "last_verified": "2026-09-09T00:00:00Z"
        }
      },
      "relationships": [],
      "review_status": "REVIEWED",
      "confidence": 1.0,
      "last_verified": "2026-09-09T00:00:00Z"
    },
    "baoyu-url-to-markdown": {
      "skill_id": "baoyu-url-to-markdown",
      "source_skill_digest": "sha256:40913749b0e95165b02771bdf17bb8ed9fa0a72787d3e09571341ab7148359d0",
      "tier": "TIER_1_CORE",
      "fields": {
        "stages": {
          "value": [
            "research"
          ],
          "provenance": "CURATED",
          "confidence": 1.0,
          "evidence": "reviewed compatibility routing seed",
          "last_verified": "2026-09-09T00:00:00Z"
        },
        "roles": {
          "value": [
            "TOOL"
          ],
          "provenance": "CURATED",
          "confidence": 1.0,
          "evidence": "reviewed compatibility routing seed",
          "last_verified": "2026-09-09T00:00:00Z"
        },
        "task_modes": {
          "value": [
            "research"
          ],
          "provenance": "CURATED",
          "confidence": 1.0,
          "evidence": "reviewed compatibility routing seed",
          "last_verified": "2026-09-09T00:00:00Z"
        },
        "domains": {
          "value": [
            "research",
            "documentation"
          ],
          "provenance": "CURATED",
          "confidence": 1.0,
          "evidence": "reviewed compatibility routing seed",
          "last_verified": "2026-09-09T00:00:00Z"
        },
        "outputs": {
          "value": [
            "sources",
            "citations"
          ],
          "provenance": "CURATED",
          "confidence": 1.0,
          "evidence": "reviewed compatibility routing seed",
          "last_verified": "2026-09-09T00:00:00Z"
        }
      },
      "relationships": [],
      "review_status": "REVIEWED",
      "confidence": 1.0,
      "last_verified": "2026-09-09T00:00:00Z"
    },
    "baseline-ui": {
      "skill_id": "baseline-ui",
      "source_skill_digest": "sha256:397142af2c39036ca4ca060abaec65c061a3f0cd619180f2dc4ba1ea4c4bfa0b",
      "tier": "TIER_1_CORE",
      "fields": {
        "stages": {
          "value": [
            "implement",
            "review",
            "verify"
          ],
          "provenance": "CURATED",
          "confidence": 1.0,
          "evidence": "reviewed compatibility routing seed",
          "last_verified": "2026-09-09T00:00:00Z"
        },
        "roles": {
          "value": [
            "REVIEW"
          ],
          "provenance": "CURATED",
          "confidence": 0.95,
          "evidence": "source-reviewed primary role assignment for routing diversity",
          "last_verified": "2026-09-09T00:00:00Z"
        },
        "task_modes": {
          "value": [
            "review",
            "implementation"
          ],
          "provenance": "CURATED",
          "confidence": 1.0,
          "evidence": "reviewed compatibility routing seed",
          "last_verified": "2026-09-09T00:00:00Z"
        },
        "domains": {
          "value": [
            "frontend"
          ],
          "provenance": "CURATED",
          "confidence": 1.0,
          "evidence": "reviewed compatibility routing seed",
          "last_verified": "2026-09-09T00:00:00Z"
        },
        "outputs": {
          "value": [
            "UI verification",
            "accessibility review"
          ],
          "provenance": "CURATED",
          "confidence": 1.0,
          "evidence": "reviewed compatibility routing seed",
          "last_verified": "2026-09-09T00:00:00Z"
        },
        "negative_triggers": {
          "value": [
            "repository audit",
            "release gate",
            "security change"
          ],
          "provenance": "CURATED",
          "confidence": 0.95,
          "evidence": "reviewed semantic exclusion signals; not an authority grant",
          "last_verified": "2026-09-09T00:00:00Z"
        }
      },
      "relationships": [],
      "review_status": "REVIEWED",
      "confidence": 1.0,
      "last_verified": "2026-09-09T00:00:00Z"
    },
    "brainstorming": {
      "skill_id": "brainstorming",
      "source_skill_digest": "sha256:a5f0aabeb53dcf8b0845c16f255b9cd72e75ed2ce7c176b0a03bbbd23808a18f",
      "tier": "TIER_1_CORE",
      "fields": {
        "stages": {
          "value": [
            "understand",
            "design",
            "plan"
          ],
          "provenance": "CURATED",
          "confidence": 1.0,
          "evidence": "reviewed compatibility routing seed",
          "last_verified": "2026-09-09T00:00:00Z"
        },
        "roles": {
          "value": [
            "PROCESS"
          ],
          "provenance": "CURATED",
          "confidence": 1.0,
          "evidence": "reviewed compatibility routing seed",
          "last_verified": "2026-09-09T00:00:00Z"
        },
        "task_modes": {
          "value": [
            "design"
          ],
          "provenance": "CURATED",
          "confidence": 1.0,
          "evidence": "reviewed compatibility routing seed",
          "last_verified": "2026-09-09T00:00:00Z"
        },
        "domains": {
          "value": [
            "product",
            "documentation"
          ],
          "provenance": "CURATED",
          "confidence": 1.0,
          "evidence": "reviewed compatibility routing seed",
          "last_verified": "2026-09-09T00:00:00Z"
        },
        "outputs": {
          "value": [
            "requirements",
            "design alternatives"
          ],
          "provenance": "CURATED",
          "confidence": 1.0,
          "evidence": "reviewed compatibility routing seed",
          "last_verified": "2026-09-09T00:00:00Z"
        }
      },
      "relationships": [],
      "review_status": "REVIEWED",